Authors,Title,Publication,Volume,Number,Pages,Year,Publisher
"Clarke, Shari; ",Challenges that Educators Face When Providing English Language Arts Instruction to K-5 Elementary Students in Title 1 Schools,,,,,2024,Walden University
"Pierrevil, Edner; ",The Acculturation Experiences of ELLs Within the Classroom Learning Environment in the United States of America,,,,,2024,National University
"Farris, Dwight Lamar; ",Engineering Faculty Descriptions of the Influence of a Student Response System on Active Learning,,,,,2024,Grand Canyon University
"Postell, Laquetta S; ",Improving Volunteers' Safety during the COVID-19 Pandemic,,,,,2024,Walden University
"Owusu, Benjamin Donsah; ",Staff Turnover and Organisational Productivity: Perspective of Staff of Sinapi Aba Savings and Loans Company Ltd,,,,,2022,University of Cape Coast
"Phillips, Angela R; ",Slow Attrition: The Role of Administrators and Professional Development in Growing the New Teacher,,,,,2023,Grand Canyon University
"Osei-Tutu, Charles; ",Leadership Personnel Experiences in Addressing Healthcare Organizations Sustainability in the United States: A Qualitative Study,,,,,2024,Grand Canyon University
"Moore, Jennifer Marie; ",Male Description of the Treatment and Recovery Process From an Eating Disorder,,,,,2023,Grand Canyon University
"De Fretes, Diego Romario; Noviany, Henny; Juliarta, Evie Farida; Sandya, Deasy; Charviandi, Adrie; ",SENTIMENT ANALYSIS OF BIG DATA TO MEASURE TOURISM'S SOCIAL AND EMOTIONAL IMPACT ON SOCIAL MEDIA: A CASE STUDY OF INDONESIA,INTERNATIONAL JOURNAL OF SOCIETY REVIEWS,2,1,46-58,2024,
"Mileham, Rebecca J; ",Strategies to Decrease Separation Rates Among Highly Skilled Manufacturing Employees to Gain a Competitive Advantage,,,,,2024,Walden University
"Salsabilla, Hanansya Nur; ",Pengembangan Karakter Peduli Lingkungan Melalui Metode Bermain Peran pada Siswa Sekolah Dasar,Jurnal Pendidikan Guru Sekolah Dasar,1,2,8-8,2024,
"Standridge, Craig A; ",Corporate Social Responsibility Programs in Supply Chain Strategies,,,,,2024,
"Ken-Giami, Ibifuro; ",An Analysis of the link between the Three Pillars of Sustainable Development Themes and Women’s Attraction to Engineering as a Career Choice,,,,,2021,"School of Mechanical and Design Engineering, University of Portsmouth"
"Wati, Dita Prihatna; Fatayan, Arum; Aproyanto, Iqbal; Ayu, Sartika; ",The Relationship between the Use of the Kahoot Application and Mathematics Learning Outcomes in the Online Learning Process for Elementary School Students,Jurnal Pendidikan dan Konseling (JPDK),5,1,1554-1558,2023,
"Pointer, Almena J; ",How Teachers Describe Their Experiences Using Technology in a Bring your Own Device (BYOD) Classroom,,,,,2023,Grand Canyon University
"Heinel, Wesley R; ",Examining the lived experiences and impact of public school leaders within Cultural Proficiency & Equity Professional Development,,,,,2024,University of Illinois at Urbana-Champaign
"Mitchell, John; ",Evaluating and publishing curriculum development activities,Southern Journal of Engineering Education,1,,3-16,2022,
"Al-Mahdi, Mohammed Matook Abood; ",An Investigation of Leadership Style and the Strategic Planning Process of Public and Private Colleges in Iraq: An Empirical Study,,,,,2021,University of Southern Queensland
"Rywalt, CE; Varney, ME; Mutton, ZM; ",Physics Education Research on Inexpensive Active-Learning Lab Modules,Massachusetts: Worcester Polytechnic Institute,,,,2019,
"Cann, Theophilus Murphy; ",Human Resource Management Information System And Organisational Performance Of The Lands Commission,,,,,2024,University of Cape Coast
"Funda, Vusumzi Neville; ",Artificial intelligence-enabled decision support system for South African higher education institutions,,,,,2023,Cape Peninsula University of Technology
"Wilson, Charlie Henry Middlebrooks; ",How Transformational Leaders Increase Nurse Retention and Decrease Attrition,,,,,2022,Walden University
"Muchairi, Alfred; ",Business process reengineering for process optimization: a case study,,,,,2022,University of Johannesburg
"Smith, Mirta Karina; ","We Are Not Resilient, We Are Overcoming: Latina Leaders and the Role of Mentors and Intersectionality",,,,,2022,Northcentral University
"Tarusu, Deysti Trifena; Zulela, Zulela; Adiansha, Adi Apriadi; ",Integrasi Pembentukan Nilai Karakter Kemandirian Siswa Sekolah Dasar dalam Pembelajaran Matematika di Era Industri 4.0,Jurnal Ilmiah Mandala Education,6,2,170-175,2020,
"Kaw, Autar; Yalcin, Ali; Clark, Renee M; ",Board 422: Using Adaptive Learning Platform Metrics for Early Identification and Personalized Support of Low-Performing Students,2023 ASEE Annual Conference & Exposition,,,,2023,
"Jones, Eric W; ",Managers Perceptions and Attitudes regarding Medication Errors in Healthcare Settings,,,,,2021,St. Thomas University
"Obuobi, Samuel Cyril Nanadei; ",Organisational justice and organisational citizenship Behaviour among tutors of college of distance Education at the university of cape coast,,,,,2023,University of Cape Coast
"Kessey, Anthony; ",Professionalism and Accounting Ethical Practices of Accountants: A Case of all District Assemblies in the Western Region of Ghana,,,,,2023,University of Cape Coast
"Kudjoe, Vera; ",Project Execution And Project Success At University Of Cape Coast: The Mediating Role Of Communication And Organisational Structure,,,,,2023,University of Cape Coast
"Moliner Miravet, Lidón; Alegre, Francisco; ","Principals' Attitudes, Knowledge, and Beliefs Regarding Active Learning Methodologies in Spain",,,,,2020,Horizon Research Publishing
"Tominc, Biba; ",A Decision-Making Framework for Immersive Reality Experience Design: A Museum Case Study,,,,,2022,Deakin University
"Mlambo, Nontobeko; ",The adoption of robotic process automation in a financial institution in South Africa,,,,,2022,Cape Peninsula University of Technology
"Reinhart, Shawn R; ",Strategies Small Businesses Use to Offer an Employer-Provided Tax-Advantaged Retirement Plan,,,,,2022,Walden University
"Lawson-Cohen, Golda Deborah; ","Encouragement of Learner Use of Text-To-Speech Software by Post-Secondary Instructors/Faculty: A Qualitative, Descriptive Study",,,,,2022,Grand Canyon University
"Nibigira, Ezechiel; ",Strategies for Accessing Finance by Small and Medium Enterprises,,,,,2022,
"Sutter, Danette Colleen; ","Emotion Regulation, Affective, Continuous, and Normative Commitment for Turnover Intentions Among Degree-Seeking Employees",,,,,2021,Walden University
"Craig, John Pierré; ",A Narrative Study of the Lived Experiences of Transgender Veterans,,,,,2021,Grand Canyon University
"Ihsan, Ihsan; Yanti, Sri; Adiansha, Adi Apriadi; Furkan, Furkan; ",Pembentukan Karakter Mandiri Siswa Sekolah Dasar Melalui Pembelajaran Daring Pada Masa Pandemi Covid-19,Jurnal Ilmiah Mandala Education,7,3,,2021,
"Criscuolo, Esperanza; ",Perceptions of Nurse's Personal Smartphone Use at Work,,,,,2021,Walden University
"Ford, Markquatt; ",Why a Women’s Domestic Violence Long-Term Shelter Is Needed,,,,,2022,Walden University
"Gehlen, Tamarah L; ","Grit, Online Learner Readiness, and Timeliness of Degree Completion for Online Students",,,,,2021,Grand Canyon University
"Randall, Derrick L; ",The Lived Experiences of African American Males in Roles of Educational Leadership,,,,,2022,St. Thomas University
"Peregoy, Lydia Ann; ",Revitalizing Health Information Systems,,,,,2021,
"Matiku, Susan Mbithe; ",A Tourism Framework for Community-Driven Sustainable Livelihood: A Comparative Study,,,,,2021,
"Kumar, Adarsh; Aggarwal, Alok; Sharma, Kriti; Goyal, Mukta; ","Active learning in E-learning: a case study to teach elliptic curve cryptosystem, its fast computational algorithms and authentication protocols for resource constraint RFID-sensor integrated mobile devices",,,,,2021,IET
"Reis, ACB; Franco, GMEF; Pacheco, RR; Miranda, ACA; ",Development of transversal skills in an extracurricular academic research project through active learning in healthcare: a case study,International Symposium on Project Approaches in Engineering Education,10,,447-456,2020,
"Muchenje, C; ",Establishing a framework for enhanced customer experience through service quality in the mobile telecommunication industry in Zimbabwe,,,,,,
"Ogunsanya, Dokpe Lilian; ",Organizational Leadership: Perceptions and Implementation of Managerial Coaching as a Professional Development Tool in the Facilitation of Learning,,,,,2020,Northcentral University
"Reisner, Nancy Lee; ",A Strategic Plan to Increase Equitable Practices in a Pacific Northwest School District,,,,,2021,
"Adhikari, Ramesh; Sharma, Vipin; ",The Role of Survey Design in Educational Research: Enhancing Data Quality and Reliability,,,,,,
"Butler, Lydia; ",Strategies for Training a Multigenerational Workforce,,,,,2018,Walden University
"Amankwah, Betina Osei; ",Drivers and Outcomes of Supplier Development among Manufacturing Firms in Ghana,,,,,2022,University of Cape Coast
"Quayson, Frank; ",Leadership Styles and Organizational Citizenship Behaviour at Effia Nkwanta Regional Hospital: the Mediating Effect of Corporate Culture,,,,,2022,University of Cape Coast
"Otabil, Evans Kow; ",Effect of Retirement Intentions Predictors on the Staff Retirement Behaviours of University of Cape Coast,,,,,2022,University of Cape Coast
"Hinton, Jeffrey A; ",High School Teachers’ Perceptions of Culturally Responsive Pedagogy,,,,,2020,Walden University
"Bikissa-Macongue, MB; Chinomona, E; ",SSIRC 2022-084 GOING GREEN ON LOGISTICS PERFORMANCE IN THE CONSTRUCTION INDUSTRY: A CASE OF SOUTHERN GAUTENG IN SOUTH AFRICA,TECHNICAL EDITING,,,676,,
"Ruane, Kevin; ",Management Strategies Used by Construction Managers to Reduce Employee Absenteeism,,,,,2020,Walden University
"Figueroa, Francheska Kae; ",Unintentional Teacher Bias Toward Spanish-Speaking English Learners: A Qualitative Descriptive Study,,,,,2020,Grand Canyon University
"Modise, Keatlegile Mantshadi; ",Identifying the factors that influence the advancement of women into managerial positions at a steel manufacturing company,,,,,2021,North-West University (South Africa)
"Mendoza, Juan J; ",Understanding Teacher Perceptions and Experiences About Active Learning Techniques in High School US History Courses at a Lower Rio Grande Valley School District,,,,,2021,The University of Texas Rio Grande Valley
"Ertelt, Bernd-Joachim; Kondurov, Roman; Scharpf, Michael; Barkov, Sergey A; Kolodeznikova, Inna V; ",Project Studies as A Transborder Didactic Tool in Higher Education (The Case of The German-Russian Study Project),SHS Web of Conferences,79,,02005,2020,EDP Sciences
"Zulela, Z; Novalia, R; ",Manajenem Sekolah Berbayar Sampah dalam Pembentukan Karakter Kemandirian dan Parenting di Sekolah Dasar,Jurnal Ilmiah Mandala Education,6,2,176-181,2020,
"Ekua Mensah, Mercy; ",Factors Influencing Young Women’s Experiences in the Choices and Use of Panties at the University of Cape Coast.,,,,,2021,University of Cape Coast
"Emmanuel, Banzoa Sandow; ",Effect of Financial Controls on Cash Management in Yunyoo-nasuan District Assembly in Ghana,,,,,2021,University of Cape Coast
"Hui, WANG; Xue-jun, ZHANG; ",DDoS Attack Detection Based on Parallel Accumulation Ranker Algorithm and Active Learning,Journal of Southwest China Normal University (Natural Science Edition),46,1,25-31,2021,Journal of Southwest China Normal University (Natural Science Edition)
"MORA, John Jairo ROMERO; ",Decision Making in Autonomous Language Education,,,,,2020,Universidad de La Sabana
"Romero Mora, John Jairo; ",Understanding decision-making in autonomous language education,,,,,2020,Universidad de La Sabana
"Belanche, Daniel; Casaló, Luis V; Orús, Carlos; Pérez-Rueda, Alfredo; ",The final version of this book chapter was published as,,,,,,
"Hawkes, Deborah; ",The Experiences of Black Parents in Choosing Intervention Programs for Juvenile Offenders,,,,,2019,Walden University
"Duarte, Marina Isabel Felizardo Correia; Leite, Carlinda; Fernandes, Preciosa; ",Engineering Education Research: what place for qualitative methodological orientation in Portuguese doctoral theses?,"Abstracts book of the 4th world conference on qualitative research, vol. 1",,,,2019,
"Qwabe, Phumlani; ",The challenge of crime-safety perceptions by tourists: the case of the Inanda Heritage Route in Durban,,,,,2019,
"Muñoz Cerón, Emilio; Ortega Jódar, María Jesús; Rubio Paramio, Miguel Ángel; Hermoso Orzáez, Manuel Jesús; ",Experiencias de un aprendizaje basado en problemas. Proyecto de integración de sistemas fotovoltaicos dirigido a universitarios y pre-universitarios,,,,,2020,
"Gualancañay Cayambe, César Armando; ",Estudio económico para la creación de una empresa consultora de marketing digital dirigida a las empresas PYMES de la ciudad de Guayaquil.,,,,,2020,"Guayaquil: ULVR, 2020."
"Castro, Alba Ayúcar; Etxeberria, Garbiñe Bereziartua; ",Ikaskuntza metodologia aktiboak Donostiako lehen hezkuntzako ikastetxeetan,Tantak. Euskal Herriko Unibertsitateko Hezkuntza Aldizkaria,31,2,,2019,
"Dontoh, Samuel; Adjei, Augustine; Amanfo, Barnabas Addai; ",Teachers’ Strategies for Managing Adolescent Students with Maladaptive Behaviours in Ghana,,,,,,
"Riegle-Crumb, Catherine; Morton, Karisma; Nguyen, Ursula; Dasgupta, Nilanjana; ",Inquiry-based instruction in science and mathematics in middle school classrooms: Examining its association with students’ attitudes by gender and race/ethnicity,AERA open,5,3,2332858419867653,2019,"SAGE Publications Sage CA: Los Angeles, CA"
"Lane, A Kelly; Meaders, Clara L; Shuman, J Kenny; Stetzer, MacKenzie R; Vinson, Erin L; Couch, Brian A; Smith, Michelle K; Stains, Marilyne; ",Making a first impression: Exploring what instructors do and say on the first day of introductory STEM courses,CBE—Life Sciences Education,20,1,ar7,2021,Am Soc Cell Biol
"Liao, Yin-Chan; Ringler, Marjorie; ",Backward design: Integrating active learning into undergraduate computer science courses,Cogent Education,10,1,2204055,2023,Taylor & Francis
"Harrison, Colin D; Nguyen, Tiffy A; Seidel, Shannon B; Escobedo, Alycia M; Hartman, Courtney; Lam, Katie; Liang, Kristen S; Martens, Miranda; Acker, Gigi N; Akana, Susan F; ","Investigating instructor talk in novel contexts: Widespread use, unexpected categories, and an emergent sampling strategy",CBE—Life Sciences Education,18,3,ar47,2019,Am Soc Cell Biol
"Johnson, Aaron W; Blackburn, Max W; Su, Magel P; Finelli, Cynthia J; ",How a flexible classroom affords active learning in electrical engineering,IEEE Transactions on Education,62,2,91-98,2018,IEEE
"Wellberg, Sarah; Evans, Carla; ",Assumptions Underlying Performance Assessment Reforms Intended to Improve Instructional Practices: A Research-Based Framework.,"Practical Assessment, Research & Evaluation",27,,23,2022,ERIC
"Dubinsky, Janet M; Hamid, Arif A; ",The neuroscience of active learning and direct instruction,Neuroscience & Biobehavioral Reviews,,,105737,2024,Pergamon
"Underwood, Sonia M; Kararo, Alex T; ",Design-based implementation research (DBIR): an approach to propagate a transformed general chemistry curriculum across multiple institutions,Journal of Chemical Education,98,12,3643-3655,2021,"American Chemical Society and Division of Chemical Education, Inc."
"Bouley, Renee; ",Redesigning a one-semester biochemistry class using in-class activities to achieve high student engagement,Journal of Chemical Education,99,8,2943-2949,2022,ACS Publications
"Loftsson, Hrafn; Matthíasdóttir, Ásrún; ",Using flipped classroom and team-based learning in a first-semester programming course: An experience report,"2019 IEEE International Conference on Engineering, Technology and Education (TALE)",,,1-6,2019,IEEE
"Herman, Geoffrey L; Azad, Sushmita; ",A comparison of peer instruction and collaborative problem solving in a computer architecture course,Proceedings of the 51st ACM Technical Symposium on Computer Science Education,,,461-467,2020,
"Rhodes, Ashley; ",Lowering barriers to active learning: a novel approach for online instructional environments,Advances in Physiology Education,45,3,547-553,2021,"American Physiological Society Rockville, MD"
"Niland, Rachel; Flinn, Clodagh; Nearchou, Finiki; ",Assessing the role of school-based sex education in sexual health behaviours: a systematic review,Cogent Psychology,11,1,2309752,2024,Taylor & Francis
"Presley, Regina G; Cumberland, Denise M; Rose, Kevin; ",A comparison of cognitive and social presence in online graduate courses: Asynchronous vs. synchronous modalities,,,,,2023,OLC
"Ali, Radwan; Thomas, Dominic; ",Innovative 3D Printing Integration in IS Education: A Case Study of Experiential Learning,Journal of Information Technology Education: Innovations in Practice,23,1,,2024,Informing Science Institute
"Allamsetty, Srikanth; Chandra, MVSS; Panigrahi, Chinmoy Kumar; ",A novel social constructivist pedagogy to teach basic electrical engineering course to undergraduate students in online mode,The International Journal of Electrical Engineering & Education,,,0020720921999747,2021,"SAGE Publications Sage UK: London, England"
"Packard, Becky Wai-Ling; Solyst, Jaemarie; Pai, Anisha; Yu, Lu; ",Peer-designed active learning modules as a strategy to improve confidence and comprehension within introductory computer science,Journal of College Science Teaching,49,5,76-83,2020,Taylor & Francis
"Kelly, Alison E; Clinton-Lisell, Virginia; Klein, Kendall A; ",Enhancing College Students' Online Group Work Perceptions and Skills Using a Utility-Value Intervention.,Online Learning,26,3,236-258,2022,ERIC
"Grant, Derisa; ",“Or is that just your opinion?“: Incorporating faculty of color into the foundational literature on learner-centered classrooms—A review,Educational Research Review,39,,100512,2023,Elsevier
"Ma, Angela Kit Fong; ",Using technology for English-medium instruction: The use of livestreaming in the marketing classroom,Multilingual Education Yearbook 2023: Teaching with Technology in English-Medium Instruction Universities in Multilingual China,,,23-47,2023,Springer
"Packard, Becky Wai-Ling; Ng Wunt Sang, Hilary; ",Preparing for Identity-Related Tensions in Active Learning STEM Classrooms,Journal of College Science Teaching,,,1-8,2024,Taylor & Francis
"Tino, Concetta; ",AN INTEGRATIVE INTERPRETATION OF PERSONAL AND CONTEXTUAL FACTORS OF STUDENTS’RESISTANCE TO ACTIVE LEARNING AND TEACHING STRATEGIES,Andragoška spoznanja,2,26,59-74,2020,Andragoška spoznanja/Studies in Adult Education and Learning
"Bressan, Mariana Aparecida; Couto, Ana Thalita Santana; Zucchi, Fabíola Cristina Ribeiro; Baroneza, José Eduardo; ",Metodologias ativas no ensino de Saúde: devemos considerar o ponto de vista dos alunos?,Revista Docência do Ensino Superior,11,,1-20,2021,
"Niland, Rachel; Nearchou, Finiki; ",Assessing the effectiveness of school-based sex education in sexual health behaviours: A systematic review,,,,,2023,OSF
"Mbusi, Nokwanda; Luneta, Kakoma; ",Implementation of an intervention program to enhance student teachers’ active learning in transformation geometry,SAGE open,13,2,21582440231179440,2023,"SAGE Publications Sage CA: Los Angeles, CA"
"Richardson, Jeanita W; ",An active learning approach to teaching social determinants of health,Pedagogy in Health Promotion,6,4,266-273,2020,"SAGE Publications Sage CA: Los Angeles, CA"
"Mejia, Kenya; Turns, Jennifer A; Roldan, Wendy; ",Four Complications in Designing a Validated Survey to Gather Information on Student Reactions to Reflection Activities,2020 ASEE Virtual Annual Conference Content Access,,,,2020,
"Osgood, Libby; ",Unordinary: An evaluation of lecture-free activities using a repertory grid,International Journal of Mechanical Engineering Education,50,4,805-827,2022,"SAGE Publications Sage UK: London, England"
"Valverde, Juan Carlos; Romero-Zúñiga, Mariela; Vargas-Fonseca, Lupita; ",Contrastes en el proceso de aprendizaje en estudiantes de la carrera de Ingeniería Forestal,Uniciencia,36,1,670-686,2022,https://creativecommons. org/licenses/by-nc-nd/3.0/deed. es
"Delancey-Bolding, Gladys; ",Qualitative study: Active learning stem experiences of high school students and facilitators,,,,,2020,Capella University
"Crockett, Caroline; Finelli, Cynthia J; Demonbrun, Matt; Nguyen, Kevin A; Rosenberg, RS; ",Common characteristics of high-quality papers studying student response to active learning,International Journal of Engineering Education,37,2,420-432,2021,Tempus Publications
"Mullins, Duncan; Swenson, Jessica; Miel, Karen; ",Pre-Service Faculty Learning Processes and Teaching Approaches,2022 IEEE Frontiers in Education Conference (FIE),,,1-9,2022,IEEE
"Akintolu, Morakinyo; Mitwally, Mohamed Ahmed; Letseka, Moeketsi; ","South African Open Distance Elearning Student: The Types, Effectiveness, and Preference of Feedback Support",West African Journal of Open and Flexible Learning,12,2,89-112,2024,
"Valverde, Juan Carlos; Romero-Zúñiga, Mariela; Vargas-Fonseca, Lupita; ",Contrasts in the learning process among Forest Engineering students,Uniciencia,36,1,670-686,2022,https://creativecommons. org/licenses/by-nc-nd/3.0/deed. es
"Edvardsen, Even Elias; Dalseth, Eline Fjærestad; Johnson, Susanne Grødem; Stigen, Linda; Mørk, Gry; Magne, Trine A; Gramstad, Astrid; Småstuen, Milada Cvancarova; Bonsaksen, Tore; ",Occupational therapy students’ preferences for teaching and course design across a three-year undergraduate education program,Irish Journal of Occupational Therapy,50,1,51-57,2022,Emerald Publishing Limited
"Packard, Becky Wai-Ling; Hirst, Rachel A; ","Stem Student Success: Strategic Learning, Mentored Research, and Structural Change",How College Students Succeed,,,147-178,,Routledge
"McAllister, Katie AL; ",Beyond the Lecture: Interacting with Students and Shaping the Classroom Dynamic,,,,,2021,Rowman & Littlefield
"Tempero Culliver, Mashika; ",How a Black Female School Leader Navigates Structural Constraints to Foster Black Female Students’ Agency in an Alabama Black Belt Public School,,,,,2023,
"Sansom, Stephen A; Clary, Todd; Aslan, Carolyn; ",Active Learning Techniques to Enhance Conceptual Learning in Greek Mythology,Classical World,116,1,75-105,2022,Johns Hopkins University Press
"Nyberg, Bjorn; Keers, Henk; Næsheim, Sigrid; Vedå, Lisbeth; Weissmann, Gary; ",SEDucate: sedimentary log exercises for an active learning environment,,,,,2023,EarthArXiv
"Hammond, Emily; Mitchell, Jayden; Swenson, Jessica; ",Students utilization of discord messaging platform in an introduction to matlab course,2022 ASEE Annual Conference & Exposition,,,,2022,
"Culliver, Mashika Tempero; ",How a Black Female School Leader Navigates Structural Constraints to Foster Black Female Students Agency in an Alabama Black Belt Public School,,,,,2023,Auburn University
"Arif, Shehla; ",Designing an Engineering Computer Instructional Laboratory: Working with the Panopticon,2020 ASEE Virtual Annual Conference Content Access,,,,2020,
"Lang, Franziska K; ",Understanding Perceptions and Beliefs Biochemistry Instructors Hold and the Influence These Factors Have on Their Personal Style of Teaching,,,,,2018,Purdue University
"Moreira, Sandrina B; ",Accounting and finance students' perceptions about active learning in an economics-lecture classroom,Learning styles and strategies for management students,,,18-34,2020,IGI Global
"Wrights, Abbie P; ",An Exploratory Case Study of One Department’s Teaching Culture in Order to Promote Active Learning,,,,,2022,The University of North Carolina at Greensboro
"Júnior, Ed Wilson; Bolzan, Willian; ",Modelgame: Bridging the Gap between Gamification and Software Modeling Teaching a Quality Model for Objective Evaluation and Enhanced Learning Experiences,Available at SSRN 4655011,,,,,
"Tino, Concetta; ",Active Learning: resistenza di studenti e studentesse: strategie per ridurla,"Educational reflective practices: 1, 2019",,,194-210,2019,Franco Angeli
"Matthíasdóttir, Ásrún; Loftsson, Hrafn; ",Improving the Implementation of a First-Semester Programming Course,Proceedings of the 16th International CDIO Conference,,,,2020,
"Alazemi, Maha Saleh Salem; Bataineh, Ruba Fahmi; ",The Use of Active Teaching and Learning Strategies in the First Three Grades in the State of Kuwait as Perceived by EFL Teachers,,,,,,
"Woolfolk, Frances Ruth; ",Improving Accounting Education,,,,,2018,
"Reaugh, Stephen; ",Building Rapport: How Active Learning Strategies Create Inclusivity in the 1st-Year Classroom,Teaching Gradually,,,158-163,,Routledge
"Dossey, Brian S; ",Equitable Practices of the Mathematics Workshop Approach Instructional Model: A Quantitative Investigation of Urban High Schools Students’ Attitudes Towards Mathematics,,,,,2022,Baylor University
"Mahaffey-Dowd, Declan Thomas; Ciston, Shannon; Pour, Negar Beheshti; ",Work in Progress: Teamwork Skills Development in ChemE Car,2021 ASEE Virtual Annual Conference Content Access,,,,2021,
"McKenzie, Leria Joy; ",High School Teachers’ Best Practices for the Use of Formative Assessment Strategies,,,,,2021,Walden University
"Nethi, Vanaja; Ramunda, Kate; ",Active Learning in Practice: Integrating the Digital Mastering APA Style Student Workbook in a Canvas Course,,,,,2022,
"Parmentier, Jean-François; Vicens, Quentin; ","Enseigner et former-2e éd.: Psychologie appliquée et pédagogies actives, secondaire, supérieur, formation professionnelle",,,,,2022,Dunod
"Wanzer, Dana Linnell; ",Dealing With a Challenging Student: Strategies From the Team‐Based Learning Listserv.,National Teaching & Learning Forum,30,1,,2020,
"Nawafleh, Waleed H; Muheedat, Razan M; ",The Effect of Using Six Dimensional Strategy PDEODE in Teaching Science on the Basic Eighth Grade Students' Achievement and their Attitudes towards it,Journal of Educational and Psychological Studies [JEPS],14,3,417-436,2020,
